{
  "$schema": "https://lovekgd.example/contracts/normalization/component-synthesis-contract.v0.1.schema.json",
  "accessibility_requirements": [
    "Expose the product name when the wordmark is the only label; mark duplicate artwork decorative inside a labelled lockup."
  ],
  "allowed_combinations": [
    {
      "axis_selections": {},
      "combination_id": "declared-axis-values",
      "rule": "Only registry-declared axis values may be combined; each rendered specimen binds an explicit fixture."
    },
    {
      "axis_selections": {},
      "combination_id": "native-nesting",
      "rule": "Every declared nested component is represented by a native instance when present."
    },
    {
      "axis_selections": {},
      "combination_id": "static-content-preserved",
      "rule": "Static resolved HTML remains useful and is never replaced by an initial skeleton."
    }
  ],
  "anatomy": [
    {
      "evidence_source": "entity_registry.anatomy",
      "label": "wordmark artwork",
      "part_id": "wordmark-artwork",
      "required": true
    }
  ],
  "candidate_disposition": "candidate_component",
  "consumers": {
    "archetype_refs": [],
    "entity_refs": [
      "brand.lockup"
    ]
  },
  "content_constraints": {
    "count_fixture_ids": [],
    "numeric_tokens_added": false,
    "policy": "Exercise short, long, multiline, numeric-heavy and absent optional Russian content without changing the source-backed boundary.",
    "text_fixture_ids": [
      "fixture.text.short-ru",
      "fixture.text.long-ru",
      "fixture.text.multiline",
      "fixture.text.numeric-heavy",
      "fixture.text.missing-optional"
    ]
  },
  "contract_version": "0.1.0-candidate",
  "display_name": "Announcements wordmark",
  "entity_kind": "content_component",
  "evidence": {
    "confidence": "high",
    "hierarchy_refs": [],
    "level": "exact_current_source_binding",
    "notes": [
      "No final color, type or numeric geometry token is selected by this synthesis."
    ],
    "registry_ref": "catalog/normalization/component-synthesis-v0.1/entity-registry.jsonl#brand.wordmark"
  },
  "fixture_plan": {
    "binding_ref": "catalog/normalization/component-synthesis-v0.1/fixtures/entity-fixture-bindings.json#fixture-binding.brand.wordmark",
    "catalog_ref": "catalog/normalization/component-synthesis-v0.1/fixtures/fixture-catalog.json",
    "count_fixture_ids": [],
    "media_fixture_ids": [],
    "runtime_fixture_ids": [
      "fixture.runtime.static-resolved"
    ],
    "text_fixture_ids": [
      "fixture.text.short-ru",
      "fixture.text.long-ru",
      "fixture.text.multiline",
      "fixture.text.numeric-heavy",
      "fixture.text.missing-optional"
    ],
    "viewport_fixture_ids": [
      "fixture.viewport.mobile-390x844",
      "fixture.viewport.mobile-430x932",
      "fixture.viewport.tablet-768x1024",
      "fixture.viewport.desktop-1280x800",
      "fixture.viewport.desktop-1728x900"
    ]
  },
  "invalid_combinations": [
    {
      "axis_selections": {},
      "combination_id": "undeclared-axis-value",
      "rule": "Any value outside the registry-declared variant or state axes is invalid."
    },
    {
      "axis_selections": {},
      "combination_id": "detached-nested-copy",
      "rule": "A detached copy cannot satisfy a nested component reference."
    },
    {
      "axis_selections": {},
      "combination_id": "static-html-skeleton",
      "rule": "Artificial skeleton replacement of useful static Astro HTML is invalid."
    },
    {
      "axis_selections": {},
      "combination_id": "accepted-canonical-promoted",
      "rule": "canonical=true, accepted=true or promotion_ready=true is invalid for synthesis v0.1."
    }
  ],
  "loading_recovery": {
    "client_wait_skeleton": "not_applicable_without_proven_client_wait",
    "recovery_states": [
      "static_resolved"
    ],
    "runtime_state_fixture_ids": [
      "fixture.runtime.static-resolved"
    ],
    "source_policy": "static_resolved; textual product-name fallback must remain available where the artwork cannot render",
    "static_html_skeleton": "forbidden"
  },
  "media": {
    "consumer_requirement_refs": [],
    "consumer_scoped": true,
    "fit_candidates": [],
    "focal_point": "Not applicable to this component boundary.",
    "global_fit_selected": false,
    "global_ratio_selected": false,
    "layout_reservation": "No event-media layout reservation is owned by this component boundary.",
    "loading_applicability": "No event-media loading treatment is owned by this component boundary.",
    "mode": "identity_asset",
    "ratio_candidates": [],
    "safe_area": "Not applicable to this component boundary.",
    "semantic_modes": [],
    "source_behavior": "Vector/typographic identity asset; no crop, distortion or independent recoloring outside declared contrast treatment.",
    "upscale": "Not applicable to this component boundary."
  },
  "nested_components": [],
  "penpot_binding": {
    "binding_status": "placeholder",
    "component_id": null,
    "detached_copy_allowed": false,
    "fixture_binding_ids": [
      "fixture-binding.brand.wordmark"
    ],
    "main_component_id": null,
    "materialization_status": "planned",
    "resource_graph_file_id": "3be9e5e1-190f-8090-8008-713c0fbe6260",
    "screenshot_master_allowed": false,
    "stable_plugin_data_id": "component-synthesis.v0.1.brand.wordmark",
    "target_page": "10 — Brand assets",
    "variant_container_id": null
  },
  "props": [
    {
      "allowed_values": [],
      "default": null,
      "evidence_source": "penpot_materialization_plan.fixture_requirements",
      "kind": "materialization_binding",
      "prop_id": "fixture_id",
      "required": true,
      "type": "fixture_ref"
    }
  ],
  "responsive_container_behavior": {
    "evidence_source": "entity_registry.responsive_behavior",
    "numeric_tokens_added": false,
    "policy": "Scale proportionally inside the declared container; exact source geometry remains implementation-derived.",
    "viewport_fixture_ids": [
      "fixture.viewport.mobile-390x844",
      "fixture.viewport.mobile-430x932",
      "fixture.viewport.tablet-768x1024",
      "fixture.viewport.desktop-1280x800",
      "fixture.viewport.desktop-1728x900"
    ]
  },
  "schema_version": "lovekgd_component_synthesis_contract_v0_1",
  "semantic_purpose": "Reusable product wordmark asset with preserved source proportions and identity.",
  "slots": [
    {
      "accepts_entity_refs": [],
      "content_constraints": [
        "Use only bound fixture content or source-derived content.",
        "Do not introduce numeric design tokens in this candidate contract."
      ],
      "detached_copy_allowed": false,
      "required": true,
      "role": "wordmark artwork",
      "slot_id": "content_wordmark-artwork"
    }
  ],
  "source": {
    "mapping_refs": [
      "catalog/normalization/component-synthesis-v0.1/current-to-candidate-mapping.jsonl#source_path=site/src/components/brand/AnnouncementsWordmark.astro"
    ],
    "source_implementations": [
      "site/src/components/brand/AnnouncementsWordmark.astro"
    ]
  },
  "stable_component_id": "brand.wordmark",
  "state_axes": [],
  "status": {
    "accepted": false,
    "authority_mode": "reconstructed",
    "canonical": false,
    "contract_decision_status": "draft",
    "product_value_status": "pending_product_model",
    "promotion_ready": false
  },
  "variant_axes": [],
  "wave_id": "W1-core-and-actions"
}
